[
  {
    "company": "Toyota Motor Corp",
    "topic": "energy_efficiency",
    "action": "install_led_lighting",
    "actor": "company",
    "target": "factory_A",
    "modality": "past_action",
    "evidence_page": 42,
    "evidence_span_text": "工場Aでは、従来の蛍光灯からLED照明へ全面的に更新し、年間電力使用量を12%削減することに成功しました。",
    "confidence": 0.95,
    "year": 2024,
    "industry": "Consumer Discretionary"
  },
  {
    "company": "Toyota Motor Corp",
    "topic": "emissions_reduction",
    "action": "reduce_emissions",
    "actor": "company",
    "target": "factory_A_operations",
    "modality": "past_action",
    "evidence_page": 42,
    "evidence_span_text": "この取り組みにより、CO2排出量は年間約300トン削減されました。",
    "confidence": 0.92,
    "year": 2024,
    "industry": "Consumer Discretionary"
  },
  {
    "company": "Toyota Motor Corp",
    "topic": "talent_development",
    "action": "train",
    "actor": "employees",
    "target": "all_employees",
    "modality": "past_action",
    "evidence_page": 42,
    "evidence_span_text": "全従業員を対象とした環境教育プログラムを実施し、延べ5,000名が受講しました。",
    "confidence": 0.88,
    "year": 2024,
    "industry": "Consumer Discretionary"
  },
  {
    "company": "Toyota Motor Corp",
    "topic": "renewable_energy",
    "action": "install_solar_panels",
    "actor": "company",
    "target": "three_major_factories",
    "modality": "past_action",
    "evidence_page": 42,
    "evidence_span_text": "主要3工場に太陽光発電システムを設置しました。合計発電容量は3.2MWであり、年間約4,000MWhの電力を自家発電することが可能となりました。",
    "confidence": 0.97,
    "year": 2024,
    "industry": "Consumer Discretionary"
  },
  {
    "company": "Toyota Motor Corp",
    "topic": "emissions_reduction",
    "action": "set_reduction_target",
    "actor": "company",
    "target": "scope1_2_emissions",
    "modality": "future_commitment",
    "evidence_page": 42,
    "evidence_span_text": "2030年までに、スコープ1・2のCO2排出量を2013年比で50%削減することを目標として掲げています。",
    "confidence": 0.90,
    "year": 2024,
    "industry": "Consumer Discretionary"
  }
]
